{
  "gap_id": "gap-1",
  "proposal_id": "proposal-1",
  "module": "problem",
  "gap_kind": "missing_information",
  "gap_status": "open",
  "field": "evidence_of_problem",
  "description": "The proposal needs clearer evidence that the intake delay is frequent and material.",
  "question_hint": "What evidence shows this delay happens often enough to prioritize?",
  "source_refs": [
    {
      "source_id": "source-1",
      "source_kind": "pasted_text",
      "label": "Initial proposal text",
      "document_id": "document-1",
      "created_at": "2026-05-24T14:00:00.000Z"
    }
  ],
  "audit_refs": [
    {
      "kind": "agent_run",
      "id": "run-1"
    }
  ],
  "warnings": [],
  "created_at": "2026-05-24T14:05:00.000Z",
  "updated_at": "2026-05-24T14:05:00.000Z"
}
